{
  "version": 1,
  "generatedAt": "2026-03-27T21:56:49Z",
  "purpose": "Public-safe status view for the ISO 27001 and SOC 2 full-mapping programme inside OpenCompliance. It reports what exists today, what remains blocked, and which workstreams must land before the mapping can be treated as exhaustive.",
  "targetState": {
    "description": "State of the art is a reviewed mapping layer in which source prose is decomposed into atomic obligations, each atom is routed to decidable, attestation, or judgment, non-judgment atoms have typed claim contracts, decidable atoms can enter Lean where appropriate, and exact anchors carry review provenance.",
    "requiredCapabilities": [
      "Exhaustive authoritative-source decomposition for the relevant ISO 27001 and SOC 2 scope.",
      "A machine-readable source-to-atom graph that survives public-private publication boundaries.",
      "Reviewed exact anchors where publication is defensible and explicit blocker records where it is not.",
      "A normalized public-control ontology with typed claim schemas and route metadata.",
      "Family-by-family fixture and evidence rollout visibility.",
      "A documented publication model for proprietary standards and an external review program."
    ]
  },
  "frameworks": [
    {
      "framework": "ISO 27001",
      "sourceAvailability": "blocked_nonpublic_source_review",
      "openComplianceState": "private_seed_depth_and_public_family_proxy",
      "summary": {
        "seedControlsTouchingFramework": 85,
        "frameworkAnchorCount": 423,
        "privateAtomicObligations": 243,
        "mappedPublicControls": 85,
        "implementedPublicControls": 38,
        "plannedPublicControls": 47,
        "leanBackedPublicControls": 21,
        "blockedExactAnchorPublicControls": 35,
        "remainingSeedControls": 0,
        "familyRolloutEntries": 29,
        "routeCounts": {
          "decidable": 22,
          "attestation": 43,
          "judgment": 19
        },
        "exactAnchorStatusCounts": {
          "public_source_reviewed": 0,
          "candidate_public_source_unreviewed": 0,
          "blocked_nonpublic_source_review": 35
        }
      },
      "familyRollout": [
        {
          "family": "awareness_and_training",
          "mappedControls": 1,
          "implementedControls": 1,
          "plannedControls": 0,
          "leanBackedControls": 0,
          "routeCounts": {
            "decidable": 0,
            "attestation": 1,
            "judgment": 0,
            "mixed": 0
          },
          "controlIds": [
            "oc.train-01"
          ]
        },
        {
          "family": "backup_and_recovery",
          "mappedControls": 4,
          "implementedControls": 4,
          "plannedControls": 0,
          "leanBackedControls": 1,
          "routeCounts": {
            "decidable": 1,
            "attestation": 2,
            "judgment": 1,
            "mixed": 0
          },
          "controlIds": [
            "oc.backup-01",
            "oc.rec-01",
            "oc.rec-02",
            "oc.rec-03"
          ]
        },
        {
          "family": "compliance_requirements",
          "mappedControls": 3,
          "implementedControls": 0,
          "plannedControls": 3,
          "leanBackedControls": 0,
          "routeCounts": {
            "decidable": 0,
            "attestation": 2,
            "judgment": 1,
            "mixed": 0
          },
          "controlIds": [
            "oc.cpl-01",
            "oc.cpl-02",
            "oc.cpl-03"
          ]
        },
        {
          "family": "continual_improvement_and_corrective_action",
          "mappedControls": 3,
          "implementedControls": 0,
          "plannedControls": 3,
          "leanBackedControls": 0,
          "routeCounts": {
            "decidable": 0,
            "attestation": 2,
            "judgment": 1,
            "mixed": 0
          },
          "controlIds": [
            "oc.gov-36",
            "oc.gov-37",
            "oc.gov-38"
          ]
        },
        {
          "family": "cryptographic_key_management",
          "mappedControls": 1,
          "implementedControls": 1,
          "plannedControls": 0,
          "leanBackedControls": 1,
          "routeCounts": {
            "decidable": 1,
            "attestation": 0,
            "judgment": 0,
            "mixed": 0
          },
          "controlIds": [
            "oc.key-01"
          ]
        },
        {
          "family": "data_retention_and_deletion",
          "mappedControls": 3,
          "implementedControls": 1,
          "plannedControls": 2,
          "leanBackedControls": 0,
          "routeCounts": {
            "decidable": 0,
            "attestation": 2,
            "judgment": 1,
            "mixed": 0
          },
          "controlIds": [
            "oc.data-04",
            "oc.data-05",
            "oc.data-06"
          ]
        },
        {
          "family": "disciplinary_process",
          "mappedControls": 3,
          "implementedControls": 0,
          "plannedControls": 3,
          "leanBackedControls": 0,
          "routeCounts": {
            "decidable": 0,
            "attestation": 2,
            "judgment": 1,
            "mixed": 0
          },
          "controlIds": [
            "oc.hr-13",
            "oc.hr-14",
            "oc.hr-15"
          ]
        },
        {
          "family": "encryption_at_rest",
          "mappedControls": 1,
          "implementedControls": 1,
          "plannedControls": 0,
          "leanBackedControls": 1,
          "routeCounts": {
            "decidable": 1,
            "attestation": 0,
            "judgment": 0,
            "mixed": 0
          },
          "controlIds": [
            "oc.crypt-01"
          ]
        },
        {
          "family": "identity_and_access_management",
          "mappedControls": 5,
          "implementedControls": 5,
          "plannedControls": 0,
          "leanBackedControls": 4,
          "routeCounts": {
            "decidable": 4,
            "attestation": 1,
            "judgment": 0,
            "mixed": 0
          },
          "controlIds": [
            "oc.id-01",
            "oc.id-02",
            "oc.id-03",
            "oc.id-04",
            "oc.id-05"
          ]
        },
        {
          "family": "incident_response",
          "mappedControls": 2,
          "implementedControls": 2,
          "plannedControls": 0,
          "leanBackedControls": 0,
          "routeCounts": {
            "decidable": 0,
            "attestation": 2,
            "judgment": 0,
            "mixed": 0
          },
          "controlIds": [
            "oc.ir-01",
            "oc.ir-02"
          ]
        },
        {
          "family": "intellectual_property_rights",
          "mappedControls": 3,
          "implementedControls": 0,
          "plannedControls": 3,
          "leanBackedControls": 0,
          "routeCounts": {
            "decidable": 0,
            "attestation": 2,
            "judgment": 1,
            "mixed": 0
          },
          "controlIds": [
            "oc.gov-39",
            "oc.gov-40",
            "oc.gov-41"
          ]
        },
        {
          "family": "internal_audit_program",
          "mappedControls": 3,
          "implementedControls": 0,
          "plannedControls": 3,
          "leanBackedControls": 0,
          "routeCounts": {
            "decidable": 0,
            "attestation": 2,
            "judgment": 1,
            "mixed": 0
          },
          "controlIds": [
            "oc.audit-01",
            "oc.audit-02",
            "oc.audit-03"
          ]
        },
        {
          "family": "isms_context_and_scope",
          "mappedControls": 3,
          "implementedControls": 0,
          "plannedControls": 3,
          "leanBackedControls": 0,
          "routeCounts": {
            "decidable": 0,
            "attestation": 2,
            "judgment": 1,
            "mixed": 0
          },
          "controlIds": [
            "oc.gov-30",
            "oc.gov-31",
            "oc.gov-32"
          ]
        },
        {
          "family": "isms_stakeholder_management",
          "mappedControls": 3,
          "implementedControls": 0,
          "plannedControls": 3,
          "leanBackedControls": 0,
          "routeCounts": {
            "decidable": 0,
            "attestation": 2,
            "judgment": 1,
            "mixed": 0
          },
          "controlIds": [
            "oc.gov-33",
            "oc.gov-34",
            "oc.gov-35"
          ]
        },
        {
          "family": "logging_and_monitoring",
          "mappedControls": 3,
          "implementedControls": 3,
          "plannedControls": 0,
          "leanBackedControls": 2,
          "routeCounts": {
            "decidable": 2,
            "attestation": 1,
            "judgment": 0,
            "mixed": 0
          },
          "controlIds": [
            "oc.log-01",
            "oc.mon-01",
            "oc.mon-02"
          ]
        },
        {
          "family": "malware_protection",
          "mappedControls": 1,
          "implementedControls": 1,
          "plannedControls": 0,
          "leanBackedControls": 1,
          "routeCounts": {
            "decidable": 1,
            "attestation": 0,
            "judgment": 0,
            "mixed": 0
          },
          "controlIds": [
            "oc.malware-01"
          ]
        },
        {
          "family": "network_security",
          "mappedControls": 6,
          "implementedControls": 6,
          "plannedControls": 0,
          "leanBackedControls": 6,
          "routeCounts": {
            "decidable": 6,
            "attestation": 0,
            "judgment": 0,
            "mixed": 0
          },
          "controlIds": [
            "oc.boundary-01",
            "oc.net-01",
            "oc.net-02",
            "oc.net-03",
            "oc.net-04",
            "oc.web-01"
          ]